{"schemaVersion":1,"name":"fixture-late-join-reconnect","id":"fixture-001","seed":42,"timeoutSeconds":5,"topology":"dedicated-server+2-clients","processes":[{"name":"server","role":"server","command":["${PYTHON}","${PEER}","--role","server"],"readyRegex":"UAP_NET_READY","failureRegex":"UAP_TEST_FAILED"},{"name":"client-1","role":"client","command":["${PYTHON}","${PEER}","--role","client"],"startAfterReady":["server"],"readyRegex":"UAP_NET_CONNECTED","completeRegex":"UAP_TEST_COMPLETE","failureRegex":"UAP_TEST_FAILED"},{"name":"client-2","role":"client","autoStart":false,"command":["${PYTHON}","${PEER}","--role","client"],"readyRegex":"UAP_NET_CONNECTED","completeRegex":"UAP_TEST_COMPLETE","failureRegex":"UAP_TEST_FAILED"}],"actions":[{"atSeconds":0.15,"type":"start","target":"client-2"},{"atSeconds":0.30,"type":"restart","target":"client-1"}]}
